{"inputs":[{"path":"B:\\Agents\\platform\\co-author-harness\\full-run-valid-template-tpcq7scp\\working\\p\\research_notes\\m5_deliverable.md","sha256":"1f1fcd21699475f9b844feb0f248dea00764d9301da6131aa0fb05158f4c276a","size":329},{"path":"B:\\Agents\\platform\\co-author-harness\\full-run-valid-template-tpcq7scp\\working\\p\\reviews\\.harness\\fixtures\\terminal-m5\\semantic-execution-3.json","sha256":"e8f245427ae9d4ca00f64f0a7d7e1cb5994a4133e00914da320c2a3117997750","size":6407},{"path":"B:\\Agents\\platform\\co-author-harness\\references\\semantics_manifest.v1.json","sha256":"bff0081411ade7e9230d9b8f3756d35b69b6df15bf1c01c2c300904f5ff79010","size":5780},{"path":"B:\\Agents\\platform\\co-author-harness\\version.json","sha256":"4b502fdfff05eb228668af53c37e444d50d3cd3d01ce244ab8c26dcdcb8cfb08","size":77},{"path":"B:\\Agents\\platform\\co-author-harness\\references\\policies\\draft_governance.v1.json","sha256":"28ad3437578468d847116744199e762d870b99ac914ee9faf170b9bc33b6b23d","size":9431},{"path":"B:\\Agents\\platform\\co-author-harness\\references\\schemas\\assignment_dispatch_claim.schema.json","sha256":"25bbc81456d092a87131ba10aad12e0f8c93d937deee31009d104b39e1dfea17","size":6522},{"path":"B:\\Agents\\platform\\co-author-harness\\references\\schemas\\assignment_dispatch_issuance.schema.json","sha256":"b150c9f5e0494bd84c4731642045974609b599b328c28ef9847b4a6ea42d39a6","size":3005},{"path":"B:\\Agents\\platform\\co-author-harness\\references\\schemas\\assignment_dispatch_kernel_authorization.schema.json","sha256":"3d37d9d7781ad703d0998d265a86818d0bfd13b41a2f2bdfa9b59c67295d6941","size":3939},{"path":"B:\\Agents\\platform\\co-author-harness\\references\\schemas\\assignment_dispatch_consumption.schema.json","sha256":"435c7c8718d16af31dc020017e5e19e9bd7fa6268873024265dd3f8bcc55e8eb","size":3755},{"path":"B:\\Agents\\platform\\co-author-harness\\references\\schemas\\assignment_host_attestation.schema.json","sha256":"f9ea3cb8f4310ff0a842863739e8a252faaf43026dce1b897ca042271d3bf7cf","size":2813},{"path":"B:\\Agents\\platform\\co-author-harness\\references\\schemas\\assignment_mutation_anchor.schema.json","sha256":"1b77ca752aaf11e31aaf0d37e6f79b255fb7b509d921449f491293bb83212f91","size":3381},{"path":"B:\\Agents\\platform\\co-author-harness\\references\\schemas\\assignment_mutation_genesis.schema.json","sha256":"3d70a65d28d47431e31e3465d21c27ed41959b4adf11221b44c7b5a1d1c823b6","size":2325},{"path":"B:\\Agents\\platform\\co-author-harness\\references\\schemas\\assignment_mutation_state.schema.json","sha256":"317404d51494cd1201f1cd4c30972899b20619509e1be09e1298243e52a1a9bb","size":2428},{"path":"B:\\Agents\\platform\\co-author-harness\\references\\schemas\\lifecycle_verifier_binding.schema.json","sha256":"bf191ba767f6ae74dfc32b477f02ff1f4cadbab962ebbe3e48c1fa3932e5d5ff","size":3868},{"path":"B:\\Agents\\platform\\co-author-harness\\references\\schemas\\canonical_bibliography_snapshot.schema.json","sha256":"a2f75e86d2fde19f0e22a0bfe7ba15b74ab4830bcdf1b37039d016cfee4f0721","size":3123},{"path":"B:\\Agents\\platform\\co-author-harness\\references\\schemas\\canonical_extract_receipt.schema.json","sha256":"96df55e74e28b80703cdec695aad49703d0bb60ef5c545524fdfa5dfb9eb914e","size":3029},{"path":"B:\\Agents\\platform\\co-author-harness\\references\\schemas\\centroid_semantic_execution.schema.json","sha256":"f4e428741fc1f1f9542f077a0ff134bc4d71b54043965d227591d65419bbcec3","size":4733},{"path":"B:\\Agents\\platform\\co-author-harness\\references\\schemas\\centroid_semantic_execution.v3.schema.json","sha256":"0ce982c8715744d57a8e37cfd6f1ff95e4a57c474ba833506adac072ca76702a","size":7631},{"path":"B:\\Agents\\platform\\co-author-harness\\references\\schemas\\evidence_publication_claim.schema.json","sha256":"a84e78c0815d75183c9928bb1211f014aa8dc9fcfc0186091097f41a201ceb37","size":671},{"path":"B:\\Agents\\platform\\co-author-harness\\references\\schemas\\evidence_publication_journal.schema.json","sha256":"b24eb155816c62de6e0a23e8f23feb3c09211984f1b1a8ad1dbc4052a804754e","size":1543},{"path":"B:\\Agents\\platform\\co-author-harness\\references\\schemas\\product_assurance.schema.json","sha256":"a10b8cf9857b4c787e5881381751192f14802af88c95c27db8995c5a219b8db9","size":1980},{"path":"B:\\Agents\\platform\\co-author-harness\\references\\schemas\\product_assurance.v2.schema.json","sha256":"6d9415adb619e6cf93676aeb333ca70386cdee27eb1e48c18df7adf4c9817a9f","size":5661},{"path":"B:\\Agents\\platform\\co-author-harness\\references\\schemas\\semantics_manifest.schema.json","sha256":"c8405570791fc39260d8d78c74f5b7e332c3edbba9e447f1779b6460c27e64a9","size":864},{"path":"B:\\Agents\\platform\\co-author-harness\\references\\schemas\\verifier_blocker.schema.json","sha256":"cbe1ddb007e6efe2a0827d4c473f6641fedc9f9ab67c2443d4011676b3b470a7","size":537},{"path":"B:\\Agents\\platform\\co-author-harness\\references\\schemas\\verifier_commit_marker.schema.json","sha256":"e2bbf719f2f46df6767e2b26e4f13773e6fa6460f26ef0e8360db24af2bd6bdf","size":1411},{"path":"B:\\Agents\\platform\\co-author-harness\\references\\schemas\\verifier_publication_manifest.schema.json","sha256":"5187cd64f4a8489de8ee71faf87ffbfed632d946b96260e369b516f44f34cd93","size":1537},{"path":"B:\\Agents\\platform\\co-author-harness\\references\\schemas\\verifier_transaction.schema.json","sha256":"0b3e46d338c41d983af32ad5090a0f48da413fc73c984d077c1a305104cb21a8","size":3167},{"path":"B:\\Agents\\platform\\co-author-harness\\scripts\\assignment_dispatch_claim.py","sha256":"27f56cab1194ed0533f771bd191a49a8396936c41e8587fcd046ffa48e5c357d","size":84877},{"path":"B:\\Agents\\platform\\co-author-harness\\scripts\\assignment_mutation_anchor.py","sha256":"7d98411f84172fe7519f08d4427fd5fa8be16b456912d71ffbc12ed4df41e350","size":16516},{"path":"B:\\Agents\\platform\\co-author-harness\\scripts\\assignment_receipt_transaction.py","sha256":"1702605e5e4387457f9f124c30545d2653a16943910dddb15e71149064fa0499","size":49553},{"path":"B:\\Agents\\platform\\co-author-harness\\scripts\\c2_evidence_validation.py","sha256":"f2a47b2954fcf63bc116875df780dbd2e0b8ac3271974d8a490cc295b26d9733","size":43986},{"path":"B:\\Agents\\platform\\co-author-harness\\scripts\\canonical_bibliography.py","sha256":"e314d6736a80b8d895af44737fe6cbcdea1cf576a436552ee75fb0fe2271b2e1","size":15377},{"path":"B:\\Agents\\platform\\co-author-harness\\scripts\\destination_capability.py","sha256":"660b2b59aea4b48677ac9dc47ce6e0c1d6d8f95cce3bc0399247f5d73d4dc479","size":14424},{"path":"B:\\Agents\\platform\\co-author-harness\\scripts\\draft_evidence_verifier.py","sha256":"cc37be3dfe3b1bf48f16054a36797fe526cd4fb4c801356bc12923469cc0a65a","size":65577},{"path":"B:\\Agents\\platform\\co-author-harness\\scripts\\evidence_publication.py","sha256":"41b701ae1f1c4eae9352fb4871eb6307581f850168fd61e25652b10d0966c77c","size":55203},{"path":"B:\\Agents\\platform\\co-author-harness\\scripts\\product_assurance.py","sha256":"70cf23995ad509e9f8b125cbf389dcd9888c4668acd4623a836d9591afe4847c","size":34956},{"path":"B:\\Agents\\platform\\co-author-harness\\scripts\\reader_accessibility_policy.py","sha256":"70e5ff601299149e14c1c602d9ccd7fd46dea2cfc2ae12376b347a9775a82eff","size":176643},{"path":"B:\\Agents\\platform\\co-author-harness\\scripts\\source_extract.py","sha256":"96c90d56cecb6f873dde61c312ed1eb51fee5133635292dc711d62e58ee4c41c","size":17112}],"plan_sha256":"033ef9d3dfbf39c7c88425d53854a0d52fe0f41bab85befdbbd3cd5360b92327","published":["reviews/.harness/verifier/terminal-m5/generation/product-assurance.json","reviews/.harness/verifier/terminal-m5/generation/verifier-transaction.json","reviews/.harness/verifier/terminal-m5/generation/publication-manifest.json","reviews/.harness/verifier/terminal-m5/generation/commit-marker.json"],"schema_version":"1.0.0","state":"published","transaction_id":"verifier-148ddc6a7ee723ee","writes":[{"path":"reviews/.harness/verifier/terminal-m5/generation/product-assurance.json","prepared":".harness-evidence-transactions/verifier-148ddc6a7ee723ee/prepared/000.bin","prior_sha256":null,"sha256":"ff3b765efc394bc49cd505e6aae0e7f61fde6af78a5275c30bb57c82b9298df6","size":1488},{"path":"reviews/.harness/verifier/terminal-m5/generation/verifier-transaction.json","prepared":".harness-evidence-transactions/verifier-148ddc6a7ee723ee/prepared/001.bin","prior_sha256":null,"sha256":"42370e9a9b4c37d950d757d904807f71544f7685961feaf9ffb5e621ddd269f6","size":6742},{"path":"reviews/.harness/verifier/terminal-m5/generation/publication-manifest.json","prepared":".harness-evidence-transactions/verifier-148ddc6a7ee723ee/prepared/002.bin","prior_sha256":null,"sha256":"2d6e71dd06b29d0e9a14ae7e834c07226974dffb896cf7671ff1f7096987be91","size":2271},{"path":"reviews/.harness/verifier/terminal-m5/generation/commit-marker.json","prepared":".harness-evidence-transactions/verifier-148ddc6a7ee723ee/prepared/003.bin","prior_sha256":null,"sha256":"aa6687cb4adf00cb8fd74e7c8df96eb07316790e30a1a305a9e2fb057e9a8af0","size":1917}]}
