{"inputs":[{"path":"B:\\Agents\\platform\\co-author-harness\\full-run-valid-template-tpcq7scp\\working\\p\\miniature.pdf","sha256":"e21a489ac04667bc46d4335e604f6e6ba3fbfa27d8f473a96d0ebce9737a6c3a","size":30678},{"path":"B:\\Agents\\platform\\co-author-harness\\full-run-valid-template-tpcq7scp\\working\\p\\reviews\\.harness\\fixtures\\terminal-m4\\synthetic-project-manifest.json","sha256":"b69a685b15d63c31d94537bce504752dc9bee4f94ff59e2700bba1f7ac17301e","size":400},{"path":"B:\\Agents\\platform\\co-author-harness\\scripts\\fixtures\\assurance_provenance_c2\\wiki\\manifest.json","sha256":"4221125abecf155091593d6686c6512d54dd0219e041cd0b6672675af9d009a2","size":241},{"path":"B:\\Agents\\platform\\co-author-harness\\scripts\\fixtures\\assurance_provenance_c2\\wiki\\policy.json","sha256":"d38bfae99c4b10de53a53d9134e33ef1b9eecda8a6b4d5b3224eea0c7dfbd8f1","size":161},{"path":"B:\\Agents\\platform\\co-author-harness\\scripts\\fixtures\\assurance_provenance_c2\\wiki\\wiki\\sources\\c2-argument.md","sha256":"a529817fa1f0a4ba27755c063fb4d26c71a97acd6773d3e3e01796c3692bd6e6","size":278},{"path":"B:\\Agents\\platform\\co-author-harness\\scripts\\fixtures\\assurance_provenance_c2\\wiki\\wiki\\sources\\c2-centroid.md","sha256":"8dfb47e1b767eaa6b03c5eed78e3e7806bdc0bdb319d161cb01d9b481b503051","size":278}],"plan_sha256":"4f79107235c6f206ecb318e785b26aa5ab961041c26bc7a5519cedec22f58834","published":["reviews/.harness/fixtures/terminal-m4/synthetic-bibliography-publication-manifest.json","reviews/.harness/fixtures/terminal-m4/canonical-bibliography-1.json","reviews/.harness/fixtures/terminal-m4/synthetic-bibliography-publication-marker.json"],"schema_version":"1.0.0","state":"published","transaction_id":"bibliography-21e2125f8a75a22c","writes":[{"path":"reviews/.harness/fixtures/terminal-m4/synthetic-bibliography-publication-manifest.json","prepared":".harness-evidence-transactions/bibliography-21e2125f8a75a22c/prepared/000.bin","prior_sha256":null,"sha256":"b5acfe68a0643a951dd39c4cdb95ebffbd5b8124032ef300056e2f93c1f8ef2f","size":2249},{"path":"reviews/.harness/fixtures/terminal-m4/canonical-bibliography-1.json","prepared":".harness-evidence-transactions/bibliography-21e2125f8a75a22c/prepared/001.bin","prior_sha256":null,"sha256":"d1b2f2b4f210646a7d00215f7e9294c6a37cdbc6aa260bbc4e5bec29e4d74d6b","size":3643},{"path":"reviews/.harness/fixtures/terminal-m4/synthetic-bibliography-publication-marker.json","prepared":".harness-evidence-transactions/bibliography-21e2125f8a75a22c/prepared/002.bin","prior_sha256":null,"sha256":"75664b5b512c9e1ad5c9c00b04cf3eead6420c93458673a15b5bed31df3c87f6","size":822}]}
