{"inputs":[{"path":"B:\\Agents\\platform\\co-author-harness\\full-run-valid-template-tpcq7scp\\working\\p\\miniature.pdf","sha256":"e21a489ac04667bc46d4335e604f6e6ba3fbfa27d8f473a96d0ebce9737a6c3a","size":30678},{"path":"B:\\Agents\\platform\\co-author-harness\\full-run-valid-template-tpcq7scp\\working\\p\\reviews\\.harness\\fixtures\\terminal-m3\\synthetic-project-manifest.json","sha256":"d01c561c76a1ea977076c19491de3f4654053c58b3f3e6161b8701f09fc22966","size":400},{"path":"C:\\Users\\young\\AppData\\Local\\Programs\\MiKTeX\\miktex\\bin\\x64\\pdftotext.exe","sha256":"640b9a93fa31fc093860c635cd410a3e30f7d1e6166cb1130993fb1985f474ff","size":343552},{"path":"B:\\Agents\\platform\\co-author-harness\\scripts\\fixtures\\assurance_provenance_c2\\expected_page_span_map.json","sha256":"bb32746f8aa7acd0e7dd0fc7524ff5c759c4ef386aa274873a853501245b3b71","size":2377}],"plan_sha256":"3fd652a3ce0c6a11e2c4eaa248e1191b09f8fd45799bd3e4bd3d320bfff426ea","published":["reviews/.harness/fixtures/terminal-m3/raw.txt","reviews/.harness/fixtures/terminal-m3/normalized.txt","reviews/.harness/fixtures/terminal-m3/page-span-map.json","reviews/.harness/fixtures/terminal-m3/synthetic-extract-publication-manifest.json","reviews/.harness/fixtures/terminal-m3/canonical-extract-2.json","reviews/.harness/fixtures/terminal-m3/synthetic-extract-publication-marker.json"],"schema_version":"1.0.0","state":"published","transaction_id":"extract-9fa2bee1177d41a4","writes":[{"path":"reviews/.harness/fixtures/terminal-m3/raw.txt","prepared":".harness-evidence-transactions/extract-9fa2bee1177d41a4/prepared/000.bin","prior_sha256":"e92f3113b26f73dcfd20f3ffef802439277a866e713a0908ea6d64e36503b942","sha256":"e92f3113b26f73dcfd20f3ffef802439277a866e713a0908ea6d64e36503b942","size":603},{"path":"reviews/.harness/fixtures/terminal-m3/normalized.txt","prepared":".harness-evidence-transactions/extract-9fa2bee1177d41a4/prepared/001.bin","prior_sha256":"62260ccc2f6bcddf37f55f23d17d184493b2ba9ab17e3d9484d757b9f2ae5b87","sha256":"62260ccc2f6bcddf37f55f23d17d184493b2ba9ab17e3d9484d757b9f2ae5b87","size":589},{"path":"reviews/.harness/fixtures/terminal-m3/page-span-map.json","prepared":".harness-evidence-transactions/extract-9fa2bee1177d41a4/prepared/002.bin","prior_sha256":"cf49a79be4011f20e6fda04df8fea81a2e6c03c6ae5daad4f1ac96bb33967fee","sha256":"cf49a79be4011f20e6fda04df8fea81a2e6c03c6ae5daad4f1ac96bb33967fee","size":1772},{"path":"reviews/.harness/fixtures/terminal-m3/synthetic-extract-publication-manifest.json","prepared":".harness-evidence-transactions/extract-9fa2bee1177d41a4/prepared/003.bin","prior_sha256":null,"sha256":"e7316bb2020cacf00b0746942320ac629e0e2d33a2932e316d83c433cd3e58a9","size":2411},{"path":"reviews/.harness/fixtures/terminal-m3/canonical-extract-2.json","prepared":".harness-evidence-transactions/extract-9fa2bee1177d41a4/prepared/004.bin","prior_sha256":null,"sha256":"b942ba944bf641ba1619148dc85e8642b5e396def10fedadad3bd10d9654c9db","size":3057},{"path":"reviews/.harness/fixtures/terminal-m3/synthetic-extract-publication-marker.json","prepared":".harness-evidence-transactions/extract-9fa2bee1177d41a4/prepared/005.bin","prior_sha256":null,"sha256":"a8ddddc81cc22479f785053026293c8419604920a8dcff7e3d5f8cdd78372ceb","size":2031}]}
