{"inputs":[{"path":"B:\\Agents\\platform\\co-author-harness\\assignment-milestone-checkpoint-a11mf69l\\walk\\miniature.pdf","sha256":"e21a489ac04667bc46d4335e604f6e6ba3fbfa27d8f473a96d0ebce9737a6c3a","size":30678},{"path":"B:\\Agents\\platform\\co-author-harness\\assignment-milestone-checkpoint-a11mf69l\\walk\\reviews\\.harness\\fixtures\\m1-initial\\synthetic-project-manifest.json","sha256":"f2a560c54aee0582c143c5b96a0d1b75c2966c2cefab5791bb613a9489c880c4","size":397},{"path":"B:\\Agents\\platform\\co-author-harness\\scripts\\fixtures\\assurance_provenance_c2\\wiki\\manifest.json","sha256":"4221125abecf155091593d6686c6512d54dd0219e041cd0b6672675af9d009a2","size":241},{"path":"B:\\Agents\\platform\\co-author-harness\\scripts\\fixtures\\assurance_provenance_c2\\wiki\\policy.json","sha256":"d38bfae99c4b10de53a53d9134e33ef1b9eecda8a6b4d5b3224eea0c7dfbd8f1","size":161},{"path":"B:\\Agents\\platform\\co-author-harness\\scripts\\fixtures\\assurance_provenance_c2\\wiki\\wiki\\sources\\c2-argument.md","sha256":"a529817fa1f0a4ba27755c063fb4d26c71a97acd6773d3e3e01796c3692bd6e6","size":278},{"path":"B:\\Agents\\platform\\co-author-harness\\scripts\\fixtures\\assurance_provenance_c2\\wiki\\wiki\\sources\\c2-centroid.md","sha256":"8dfb47e1b767eaa6b03c5eed78e3e7806bdc0bdb319d161cb01d9b481b503051","size":278}],"plan_sha256":"bbb42935459c5923cb87c376b6d1c9d16378e2596470e3b4834052d6e86d900c","published":["reviews/.harness/fixtures/m1-initial/synthetic-bibliography-publication-manifest.json","reviews/.harness/fixtures/m1-initial/canonical-bibliography-1.json","reviews/.harness/fixtures/m1-initial/synthetic-bibliography-publication-marker.json"],"schema_version":"1.0.0","state":"published","transaction_id":"bibliography-94372ad142a5ea35","writes":[{"path":"reviews/.harness/fixtures/m1-initial/synthetic-bibliography-publication-manifest.json","prepared":".harness-evidence-transactions/bibliography-94372ad142a5ea35/prepared/000.bin","prior_sha256":null,"sha256":"1cab7288c388ce61dbd021b69801a33fb3cea0c1bc18d68fe52936c32904ff0e","size":2246},{"path":"reviews/.harness/fixtures/m1-initial/canonical-bibliography-1.json","prepared":".harness-evidence-transactions/bibliography-94372ad142a5ea35/prepared/001.bin","prior_sha256":null,"sha256":"8615abb83acfbd868ec2a3d81c1749b83ec92c8e14a64ec3c09c16f50ec69da2","size":3637},{"path":"reviews/.harness/fixtures/m1-initial/synthetic-bibliography-publication-marker.json","prepared":".harness-evidence-transactions/bibliography-94372ad142a5ea35/prepared/002.bin","prior_sha256":null,"sha256":"d567aaa71b489e1058df0ae5ac949d344e33f512199a172cd5e9e588d4a6fc71","size":819}]}
