{"inputs":[{"path":"B:\\Agents\\platform\\co-author-harness\\full-run-valid-template-i9dfhfr1\\working\\p\\miniature.pdf","sha256":"e21a489ac04667bc46d4335e604f6e6ba3fbfa27d8f473a96d0ebce9737a6c3a","size":30678},{"path":"B:\\Agents\\platform\\co-author-harness\\full-run-valid-template-i9dfhfr1\\working\\p\\reviews\\.harness\\fixtures\\terminal-m5\\synthetic-project-manifest.json","sha256":"5d6dafd369af7f1bd62579096008d01fad9c6f19c10ab6a101b2962444e9c10d","size":400},{"path":"C:\\Users\\young\\AppData\\Local\\Programs\\MiKTeX\\miktex\\bin\\x64\\pdftotext.exe","sha256":"640b9a93fa31fc093860c635cd410a3e30f7d1e6166cb1130993fb1985f474ff","size":343552},{"path":"B:\\Agents\\platform\\co-author-harness\\scripts\\fixtures\\assurance_provenance_c2\\expected_page_span_map.json","sha256":"bb32746f8aa7acd0e7dd0fc7524ff5c759c4ef386aa274873a853501245b3b71","size":2377}],"plan_sha256":"e3aa3a81da6382152afd86c819137bcf51c65309dee35c6919b922fb232b58f8","published":["reviews/.harness/fixtures/terminal-m5/raw.txt","reviews/.harness/fixtures/terminal-m5/normalized.txt","reviews/.harness/fixtures/terminal-m5/page-span-map.json","reviews/.harness/fixtures/terminal-m5/synthetic-extract-publication-manifest.json","reviews/.harness/fixtures/terminal-m5/canonical-extract-2.json","reviews/.harness/fixtures/terminal-m5/synthetic-extract-publication-marker.json"],"schema_version":"1.0.0","state":"published","transaction_id":"extract-a6fedce94c310422","writes":[{"path":"reviews/.harness/fixtures/terminal-m5/raw.txt","prepared":".harness-evidence-transactions/extract-a6fedce94c310422/prepared/000.bin","prior_sha256":"e92f3113b26f73dcfd20f3ffef802439277a866e713a0908ea6d64e36503b942","sha256":"e92f3113b26f73dcfd20f3ffef802439277a866e713a0908ea6d64e36503b942","size":603},{"path":"reviews/.harness/fixtures/terminal-m5/normalized.txt","prepared":".harness-evidence-transactions/extract-a6fedce94c310422/prepared/001.bin","prior_sha256":"62260ccc2f6bcddf37f55f23d17d184493b2ba9ab17e3d9484d757b9f2ae5b87","sha256":"62260ccc2f6bcddf37f55f23d17d184493b2ba9ab17e3d9484d757b9f2ae5b87","size":589},{"path":"reviews/.harness/fixtures/terminal-m5/page-span-map.json","prepared":".harness-evidence-transactions/extract-a6fedce94c310422/prepared/002.bin","prior_sha256":"cf49a79be4011f20e6fda04df8fea81a2e6c03c6ae5daad4f1ac96bb33967fee","sha256":"cf49a79be4011f20e6fda04df8fea81a2e6c03c6ae5daad4f1ac96bb33967fee","size":1772},{"path":"reviews/.harness/fixtures/terminal-m5/synthetic-extract-publication-manifest.json","prepared":".harness-evidence-transactions/extract-a6fedce94c310422/prepared/003.bin","prior_sha256":null,"sha256":"40f08fbe6bff1a82d5dded652e945026fc44b0eff33ef3ba2fd90ee5100e5215","size":2411},{"path":"reviews/.harness/fixtures/terminal-m5/canonical-extract-2.json","prepared":".harness-evidence-transactions/extract-a6fedce94c310422/prepared/004.bin","prior_sha256":null,"sha256":"2d211a32eaf2f140422c2aa775ea7c963fdcd39a47cf33f905834f6b5d6a47c2","size":3057},{"path":"reviews/.harness/fixtures/terminal-m5/synthetic-extract-publication-marker.json","prepared":".harness-evidence-transactions/extract-a6fedce94c310422/prepared/005.bin","prior_sha256":null,"sha256":"0f7892652fc269ffb85bc6f70c7bdecb9ac4da437c72654c8088d1eb9dfdec40","size":2031}]}
