{"inputs":[{"path":"B:\\Agents\\platform\\co-author-harness\\full-run-valid-template-tpcq7scp\\working\\p\\miniature.pdf","sha256":"e21a489ac04667bc46d4335e604f6e6ba3fbfa27d8f473a96d0ebce9737a6c3a","size":30678},{"path":"B:\\Agents\\platform\\co-author-harness\\full-run-valid-template-tpcq7scp\\working\\p\\reviews\\.harness\\fixtures\\terminal-m3\\synthetic-project-manifest.json","sha256":"d01c561c76a1ea977076c19491de3f4654053c58b3f3e6161b8701f09fc22966","size":400},{"path":"B:\\Agents\\platform\\co-author-harness\\scripts\\fixtures\\assurance_provenance_c2\\wiki\\manifest.json","sha256":"4221125abecf155091593d6686c6512d54dd0219e041cd0b6672675af9d009a2","size":241},{"path":"B:\\Agents\\platform\\co-author-harness\\scripts\\fixtures\\assurance_provenance_c2\\wiki\\policy.json","sha256":"d38bfae99c4b10de53a53d9134e33ef1b9eecda8a6b4d5b3224eea0c7dfbd8f1","size":161},{"path":"B:\\Agents\\platform\\co-author-harness\\scripts\\fixtures\\assurance_provenance_c2\\wiki\\wiki\\sources\\c2-argument.md","sha256":"a529817fa1f0a4ba27755c063fb4d26c71a97acd6773d3e3e01796c3692bd6e6","size":278},{"path":"B:\\Agents\\platform\\co-author-harness\\scripts\\fixtures\\assurance_provenance_c2\\wiki\\wiki\\sources\\c2-centroid.md","sha256":"8dfb47e1b767eaa6b03c5eed78e3e7806bdc0bdb319d161cb01d9b481b503051","size":278}],"plan_sha256":"76a06a1f9d3b48ee6535d00499cf813b4268a64b4ad2f7cb30d4b9f0777b25c2","published":["reviews/.harness/fixtures/terminal-m3/synthetic-bibliography-publication-manifest.json","reviews/.harness/fixtures/terminal-m3/canonical-bibliography-1.json","reviews/.harness/fixtures/terminal-m3/synthetic-bibliography-publication-marker.json"],"schema_version":"1.0.0","state":"published","transaction_id":"bibliography-202ea32fbfde03eb","writes":[{"path":"reviews/.harness/fixtures/terminal-m3/synthetic-bibliography-publication-manifest.json","prepared":".harness-evidence-transactions/bibliography-202ea32fbfde03eb/prepared/000.bin","prior_sha256":null,"sha256":"2314b3e26caa00c8dcc87b3b78ef7ae6dabe00f69aad091c0ea71af650b84aef","size":2249},{"path":"reviews/.harness/fixtures/terminal-m3/canonical-bibliography-1.json","prepared":".harness-evidence-transactions/bibliography-202ea32fbfde03eb/prepared/001.bin","prior_sha256":null,"sha256":"da8d384c0575e79070d5c40ab85849d3b77080798a29a36da7038a9344176d9d","size":3643},{"path":"reviews/.harness/fixtures/terminal-m3/synthetic-bibliography-publication-marker.json","prepared":".harness-evidence-transactions/bibliography-202ea32fbfde03eb/prepared/002.bin","prior_sha256":null,"sha256":"9c4f6f0fefe4e4d27c6ac8a8031b94b1e0636e70eaf3233d04f881e405daf250","size":822}]}
