{"inputs":[{"path":"B:\\Agents\\platform\\co-author-harness\\assignment-milestone-checkpoint-a11mf69l\\walk\\miniature.pdf","sha256":"e21a489ac04667bc46d4335e604f6e6ba3fbfa27d8f473a96d0ebce9737a6c3a","size":30678},{"path":"B:\\Agents\\platform\\co-author-harness\\assignment-milestone-checkpoint-a11mf69l\\walk\\reviews\\.harness\\fixtures\\m2-initial\\synthetic-project-manifest.json","sha256":"edada29a91002a6d597c4ae19300f2fbb59e5f77b22882eebc4f4d43dcf3cb34","size":405},{"path":"C:\\Users\\young\\AppData\\Local\\Programs\\MiKTeX\\miktex\\bin\\x64\\pdftotext.exe","sha256":"640b9a93fa31fc093860c635cd410a3e30f7d1e6166cb1130993fb1985f474ff","size":343552},{"path":"B:\\Agents\\platform\\co-author-harness\\scripts\\fixtures\\assurance_provenance_c2\\expected_page_span_map.json","sha256":"bb32746f8aa7acd0e7dd0fc7524ff5c759c4ef386aa274873a853501245b3b71","size":2377}],"plan_sha256":"6813eb19a5940e410f48d64b9a4aa86a2900c48bb54649e31c1d29ba8c376ab3","published":["reviews/.harness/fixtures/m2-initial/raw.txt","reviews/.harness/fixtures/m2-initial/normalized.txt","reviews/.harness/fixtures/m2-initial/page-span-map.json","reviews/.harness/fixtures/m2-initial/synthetic-extract-publication-manifest.json","reviews/.harness/fixtures/m2-initial/canonical-extract-2.json","reviews/.harness/fixtures/m2-initial/synthetic-extract-publication-marker.json"],"schema_version":"1.0.0","state":"published","transaction_id":"extract-8bb4ad11e75c3bed","writes":[{"path":"reviews/.harness/fixtures/m2-initial/raw.txt","prepared":".harness-evidence-transactions/extract-8bb4ad11e75c3bed/prepared/000.bin","prior_sha256":"e92f3113b26f73dcfd20f3ffef802439277a866e713a0908ea6d64e36503b942","sha256":"e92f3113b26f73dcfd20f3ffef802439277a866e713a0908ea6d64e36503b942","size":603},{"path":"reviews/.harness/fixtures/m2-initial/normalized.txt","prepared":".harness-evidence-transactions/extract-8bb4ad11e75c3bed/prepared/001.bin","prior_sha256":"62260ccc2f6bcddf37f55f23d17d184493b2ba9ab17e3d9484d757b9f2ae5b87","sha256":"62260ccc2f6bcddf37f55f23d17d184493b2ba9ab17e3d9484d757b9f2ae5b87","size":589},{"path":"reviews/.harness/fixtures/m2-initial/page-span-map.json","prepared":".harness-evidence-transactions/extract-8bb4ad11e75c3bed/prepared/002.bin","prior_sha256":"cf49a79be4011f20e6fda04df8fea81a2e6c03c6ae5daad4f1ac96bb33967fee","sha256":"cf49a79be4011f20e6fda04df8fea81a2e6c03c6ae5daad4f1ac96bb33967fee","size":1772},{"path":"reviews/.harness/fixtures/m2-initial/synthetic-extract-publication-manifest.json","prepared":".harness-evidence-transactions/extract-8bb4ad11e75c3bed/prepared/003.bin","prior_sha256":null,"sha256":"244f7a46490c4f244213e3040d8deda7aaf87ebf4226c6e6d797fcc4adde13c5","size":2403},{"path":"reviews/.harness/fixtures/m2-initial/canonical-extract-2.json","prepared":".harness-evidence-transactions/extract-8bb4ad11e75c3bed/prepared/004.bin","prior_sha256":null,"sha256":"b1f5083cbccd35487a267db7f1e09a8826258390e048d4ca5c980b062866d278","size":3046},{"path":"reviews/.harness/fixtures/m2-initial/synthetic-extract-publication-marker.json","prepared":".harness-evidence-transactions/extract-8bb4ad11e75c3bed/prepared/005.bin","prior_sha256":null,"sha256":"ef8508848ca340e639400ef278d3d2e62d81680fb605e926da7032352ff48525","size":2022}]}
