{"inputs":[{"path":"B:\\Agents\\platform\\co-author-harness\\full-run-valid-template-i9dfhfr1\\working\\p\\miniature.pdf","sha256":"e21a489ac04667bc46d4335e604f6e6ba3fbfa27d8f473a96d0ebce9737a6c3a","size":30678},{"path":"B:\\Agents\\platform\\co-author-harness\\full-run-valid-template-i9dfhfr1\\working\\p\\reviews\\.harness\\fixtures\\terminal-m1\\synthetic-project-manifest.json","sha256":"c4b8d95709994f81093641c7a4739267e8539b7d20a9d6dcb45552433c7104f6","size":400},{"path":"B:\\Agents\\platform\\co-author-harness\\scripts\\fixtures\\assurance_provenance_c2\\wiki\\manifest.json","sha256":"4221125abecf155091593d6686c6512d54dd0219e041cd0b6672675af9d009a2","size":241},{"path":"B:\\Agents\\platform\\co-author-harness\\scripts\\fixtures\\assurance_provenance_c2\\wiki\\policy.json","sha256":"d38bfae99c4b10de53a53d9134e33ef1b9eecda8a6b4d5b3224eea0c7dfbd8f1","size":161},{"path":"B:\\Agents\\platform\\co-author-harness\\scripts\\fixtures\\assurance_provenance_c2\\wiki\\wiki\\sources\\c2-argument.md","sha256":"a529817fa1f0a4ba27755c063fb4d26c71a97acd6773d3e3e01796c3692bd6e6","size":278},{"path":"B:\\Agents\\platform\\co-author-harness\\scripts\\fixtures\\assurance_provenance_c2\\wiki\\wiki\\sources\\c2-centroid.md","sha256":"8dfb47e1b767eaa6b03c5eed78e3e7806bdc0bdb319d161cb01d9b481b503051","size":278}],"plan_sha256":"128405a92851c79fa64d848f8a836ce3a132c03404f3bb67bd2a59758173467d","published":["reviews/.harness/fixtures/terminal-m1/synthetic-bibliography-publication-manifest.json","reviews/.harness/fixtures/terminal-m1/canonical-bibliography-1.json","reviews/.harness/fixtures/terminal-m1/synthetic-bibliography-publication-marker.json"],"schema_version":"1.0.0","state":"published","transaction_id":"bibliography-e4fb12077053c862","writes":[{"path":"reviews/.harness/fixtures/terminal-m1/synthetic-bibliography-publication-manifest.json","prepared":".harness-evidence-transactions/bibliography-e4fb12077053c862/prepared/000.bin","prior_sha256":null,"sha256":"01ac221e5565d76771ed52800c8d00f3c89894ba13729f172d86b27bfef46853","size":2249},{"path":"reviews/.harness/fixtures/terminal-m1/canonical-bibliography-1.json","prepared":".harness-evidence-transactions/bibliography-e4fb12077053c862/prepared/001.bin","prior_sha256":null,"sha256":"8042e7bf1ee87277afef5646e7f12de481fbaba7b837ce13c40c461746a91126","size":3643},{"path":"reviews/.harness/fixtures/terminal-m1/synthetic-bibliography-publication-marker.json","prepared":".harness-evidence-transactions/bibliography-e4fb12077053c862/prepared/002.bin","prior_sha256":null,"sha256":"dbed71043087564d8a9d68030d6854e33709afd7e326848109884d7cefcbafe3","size":822}]}
