{"inputs":[{"path":"B:\\Agents\\platform\\co-author-harness\\full-run-valid-template-i9dfhfr1\\working\\p\\miniature.pdf","sha256":"e21a489ac04667bc46d4335e604f6e6ba3fbfa27d8f473a96d0ebce9737a6c3a","size":30678},{"path":"B:\\Agents\\platform\\co-author-harness\\full-run-valid-template-i9dfhfr1\\working\\p\\reviews\\.harness\\fixtures\\terminal-m5\\synthetic-project-manifest.json","sha256":"5d6dafd369af7f1bd62579096008d01fad9c6f19c10ab6a101b2962444e9c10d","size":400},{"path":"B:\\Agents\\platform\\co-author-harness\\scripts\\fixtures\\assurance_provenance_c2\\wiki\\manifest.json","sha256":"4221125abecf155091593d6686c6512d54dd0219e041cd0b6672675af9d009a2","size":241},{"path":"B:\\Agents\\platform\\co-author-harness\\scripts\\fixtures\\assurance_provenance_c2\\wiki\\policy.json","sha256":"d38bfae99c4b10de53a53d9134e33ef1b9eecda8a6b4d5b3224eea0c7dfbd8f1","size":161},{"path":"B:\\Agents\\platform\\co-author-harness\\scripts\\fixtures\\assurance_provenance_c2\\wiki\\wiki\\sources\\c2-argument.md","sha256":"a529817fa1f0a4ba27755c063fb4d26c71a97acd6773d3e3e01796c3692bd6e6","size":278},{"path":"B:\\Agents\\platform\\co-author-harness\\scripts\\fixtures\\assurance_provenance_c2\\wiki\\wiki\\sources\\c2-centroid.md","sha256":"8dfb47e1b767eaa6b03c5eed78e3e7806bdc0bdb319d161cb01d9b481b503051","size":278}],"plan_sha256":"e5d12f9536e366cd5a2eb6dbac8a07193cc4124218b4f72a9da2b279716532b8","published":["reviews/.harness/fixtures/terminal-m5/synthetic-bibliography-publication-manifest.json","reviews/.harness/fixtures/terminal-m5/canonical-bibliography-1.json","reviews/.harness/fixtures/terminal-m5/synthetic-bibliography-publication-marker.json"],"schema_version":"1.0.0","state":"published","transaction_id":"bibliography-d37eddbd7ac249c9","writes":[{"path":"reviews/.harness/fixtures/terminal-m5/synthetic-bibliography-publication-manifest.json","prepared":".harness-evidence-transactions/bibliography-d37eddbd7ac249c9/prepared/000.bin","prior_sha256":null,"sha256":"ea6720b16539185e75dbb30f8a10fd03043d3d2c18e3b067cb62b038d5141630","size":2249},{"path":"reviews/.harness/fixtures/terminal-m5/canonical-bibliography-1.json","prepared":".harness-evidence-transactions/bibliography-d37eddbd7ac249c9/prepared/001.bin","prior_sha256":null,"sha256":"6c43817e5b53483098382703bccd6b656abe97e942f5031070a41ef82045cf0c","size":3643},{"path":"reviews/.harness/fixtures/terminal-m5/synthetic-bibliography-publication-marker.json","prepared":".harness-evidence-transactions/bibliography-d37eddbd7ac249c9/prepared/002.bin","prior_sha256":null,"sha256":"a076c5d121a79a0e4d6ad8044f9d0a050ff1e8c5b72689c4d6094edbdb67a018","size":822}]}
